{
  "$schema": "https://json-schema.org/draft/2020-12/schema",
  "$id": "https://framework.local/schemas/framework.config.json",
  "title": "framework.config.json",
  "description": "实例工程根目录 framework.config.json 的结构化描述（project_name 为实例名）；权威解析与默认合并逻辑见 framework/harness/config.ts",
  "type": "object",
  "required": ["schema_version", "project_name", "architecture", "paths"],
  "properties": {
    "schema_version": {
      "type": "string",
      "description": "实例 DSL schema 版本；1.1 起包含 workflow/extensions/hooks 默认字段语义。"
    },
    "project_name": { "type": "string" },
    "project_type": {
      "type": "string",
      "enum": ["app", "atomic_service"],
      "description": "Deprecated：仅存 alias；权威子型请写 project_profile.sub_variant（element-service = 原 atomic_service）"
    },
    "project_profile": {
      "type": "object",
      "required": ["name"],
      "properties": {
        "name": { "type": "string", "description": "对应 framework/profiles/<name>/" },
        "sub_variant": { "type": "string" }
      },
      "additionalProperties": false
    },
    "agent_adapter": {
      "type": "string",
      "description": "Deprecated in project config: use framework.local.json. Kept for legacy migration."
    },
    "materialized_adapters": {
      "type": "array",
      "items": { "type": "string" },
      "description": "Project-level list of adapter artifacts to materialize (claude, cursor, generic)"
    },
    "architecture": { "type": "object" },
    "paths": {
      "type": "object",
      "properties": {
        "features_dir": { "type": "string" },
        "module_catalog": { "type": "string" },
        "component_index": { "type": "string", "description": "可选源码派生组件索引；文件存在即启用。" },
        "component_catalog": { "type": "string", "description": "可选人工策展组件台账；引用组件索引。" },
        "glossary": { "type": "string" },
        "glossary_seed": { "type": "string" },
        "architecture_md": { "type": "string" },
        "conventions": {
          "type": "string",
          "description": "可选工程惯例知识资产；默认 doc/conventions.md，文件存在即启用。"
        },
        "state_file": { "type": "string" },
        "receipt_dir_pattern": { "type": "string" },
        "docs_committed": { "type": "boolean" },
        "extension_dir": {
          "type": "string",
          "description": "实例扩展根目录（相对实例工程根），默认 doc/extensions。"
        },
        "agent_bundle_root": {
          "type": "string",
          "description": "generic adapter：agent bundle 根目录（相对实例工程根），如 .agents。"
        },
        "agent_bundle_skill_mode": {
          "type": "string",
          "enum": ["bridge", "inline"],
          "description": "generic adapter：bundle 内 skills 物化方式。恒为 bridge 薄跳板；inline 已彻底废弃（DEPRECATED），load/写盘 normalize 时一律归一为 bridge（enum 保留 inline 仅为兼容历史磁盘 config，不再生效）。"
        }
      },
      "additionalProperties": true
    },
    "toolchain": {
      "type": "object",
      "properties": {
        "hmosDevice": {
          "type": "object",
          "properties": {
            "killHdcServerOnFinish": { "type": "boolean" },
            "aaTestTimeoutMs": { "type": "number", "minimum": 1 },
            "testRunner": { "type": "string" }
          },
          "additionalProperties": false
        },
        "hvigor": { "type": "object" },
        "preferredProduct": { "type": "string" }
      },
      "additionalProperties": false
    },
    "tools": { "type": "object" },
    "integrity": {
      "type": "object",
      "description": "【已退役，读取即忽略】历史 runtime 漂移配置。framework 写权限由模型外安全主体授予；无法强隔离时仅保留合作式编辑工具守卫并明确 shell/脚本/场外进程盲区，不再运行 Git/hash 检测。保留字段仅为让存量配置不报 schema 错；它不影响 guard/verdict，也不产生运行时 advisory。",
      "deprecated": true,
      "properties": {
        "allow_local_drift": {
          "description": "【已退役，不再生效】任何形态都不降级、不放行。",
          "oneOf": [
            { "type": "boolean" },
            {
              "type": "object",
              "properties": {
                "enabled": { "type": "boolean" },
                "rationale": { "type": "string" },
                "approved_by": { "type": "string", "description": "真人签名；自动化身份/user_requirement 无效" }
              },
              "additionalProperties": false
            }
          ]
        },
        "drift_allowlist": {
          "type": "array",
          "description": "【已退役，不再生效】任何条目形态都不解锁写守卫，也不影响普通 phase 裁决。",
          "items": {
            "oneOf": [
              { "type": "string" },
              {
                "type": "object",
                "properties": {
                  "path": { "type": "string" },
                  "rationale": { "type": "string" },
                  "approved_by": { "type": "string", "description": "真人签名；自动化身份/user_requirement 无效" }
                },
                "required": ["path"],
                "additionalProperties": false
              }
            ]
          }
        }
      },
      "additionalProperties": false
    },
    "state_machine": { "type": "object" },
    "spec": {
      "type": "object",
      "description": "spec 阶段 opt-in 脚本行为（visual_handoff_enforcement / ui_spec_enforcement / visual_sources）。"
    },
    "coding": {
      "type": "object",
      "description": "coding 阶段 opt-in 脚本行为（visual_parity_enforcement）。"
    },
    "active_workflow": {
      "type": "string",
      "description": "framework/workflows/<name>.workflow.yaml 的 stem；默认 obligation-driven。"
    },
    "lifecycle_hooks_enabled": {
      "type": "boolean",
      "description": "是否运行 lifecycle hooks（framework/profile/extension）；默认 true。"
    },
    "evidence_profile": {
      "type": "string",
      "enum": ["strict", "balanced"],
      "description": "证据档位：缺省 strict；显式 balanced 在 interactive/headless/goal 均生效。minimal 仅为历史只读标签，不可配置。"
    },
    "project_scale": {
      "type": "string",
      "enum": ["small", "standard"],
      "description": "C4 exploration-scale：小工程裁剪档位（缺省 standard=现状零变化）。small 档由 framework-init 按 catalog 模块数（≤3）等信号建议、经用户确认写入；仅影响术语消歧确认粒度/module-graph 默认开关/catalog 卡片字段精简，diff_within_scope 与 Scope 声明等红线在 small 档不豁免。"
    },
    "phases_disabled": {
      "type": "array",
      "items": { "type": "string" },
      "description": "C4 exploration-scale：实例级禁用 phase 列表，与 profile 声明的 phases_disabled 取并集（profile-loader 统一裁剪）。small 档 framework-init 默认建议写入 [\"module-graph\"]（用户可移除）；红线相关 phase 不受此字段影响。"
    }
  },
  "additionalProperties": true
}
